twitter_id,date,tweet,lang,data
1679969624484646914,2023-07-14T21:42:25.000Z,"b'When we examine the past, it becomes obvious why the successful eradication of smallpox a century ago is still relevant today. https://t.co/gyydAw27Ff'",en,
1679901971099308033,2023-07-14T17:13:35.000Z,"b"".@dsengeh is revolutionizing Sierra Leone's healthcare and education sectors with his remarkable determination. https://t.co/IdjtU2Jsgg""",en,
1679172956696752128,2023-07-12T16:56:45.000Z,"b""RT @gatesfoundation: On #MalalaDay and every day, we're inspired by @malala to ensure all girls have the access and opportunities they need\xe2\x80\xa6""",en,
1678837167295176706,2023-07-11T18:42:26.000Z,"b'The risks of AI are real, and they can seem overwhelming\xe2\x80\x94but the best reason to believe we can manage them is that we\xe2\x80\x99ve done it before. History shows it\xe2\x80\x99s possible to solve challenges created by new technologies, and if governments and the private sector do their parts, we can\xe2\x80\xa6 https://t.co/oTpOScAS5S'",en,
1678566781819166720,2023-07-11T00:48:01.000Z,"b'A new @gavi-approved vaccine has the power to protect children from six different diseases, including polio. By lowering barriers to access, we can keep kids safe from paralysis and prevent a global resurgence of this devastating disease. #EndPolio https://t.co/Xgxmb7Vfgu'",en,
1677424361240932352,2023-07-07T21:08:27.000Z,"b'With TB cases and deaths on the rise, the need for new tools has never been more urgent. https://t.co/GEv5OpLoOO'",en,
1677407170432995329,2023-07-07T20:00:08.000Z,"b'When you\xe2\x80\x99re learning about something, it\xe2\x80\x99s important to let yourself be confused: https://t.co/XK3LYZ9pCI https://t.co/E5aeI3RxxJ'",en,
1676995880782819328,2023-07-06T16:45:49.000Z,b'Getting \xe2\x80\x9cunconfused\xe2\x80\x9d is one of the best ways to learn something new. That\xe2\x80\x99s what my new podcast is all about. https://t.co/fvnnfWd0zn https://t.co/Xppg4AjKAj',en,
1676693466569637888,2023-07-05T20:44:08.000Z,"b'Climate tech innovators fill me with hope. @Breakthrough-backed @FormEnergyInc and @CFS_energy are two startups leading the way toward a clean, abundant energy future. https://t.co/kMzVR55Qnt'",en,
1674816353700810753,2023-06-30T16:25:09.000Z,b'I joined #EEI2023 to discuss what it will take to build a clean energy future. In short: We need to build more transmission capacity and embrace new technologies\xe2\x80\x94and we need to do it faster than we have before. https://t.co/NlzBV3fu6d',en,
1674088419121836033,2023-06-28T16:12:36.000Z,"b'Funding from @wellcometrust and @gatesfoundation will support the phase 3 trial of a TB vaccine candidate called M72. If successful, M72 could help accelerate progress toward ending TB as a public health threat &amp; greatly improve lives around the world. https://t.co/cM3kqZmCIY'",en,
1673823213670010880,2023-06-27T22:38:46.000Z,b'I agree strongly with this. https://t.co/T7XyFrv89V',en,
1673457806333317120,2023-06-26T22:26:47.000Z,b'It was a busy but inspiring week in Nigeria and Niger. https://t.co/HZyL3Ig0ef',en,
1673430850707546112,2023-06-26T20:39:40.000Z,"b'RT @Ebuka: I invited @BillGates back to Lagos for Detty December...\n\nBut only after we talked about why he loves to visit here, and how you\xe2\x80\xa6'",en,
1673117795868106753,2023-06-25T23:55:42.000Z,b'You can check your answer here... https://t.co/9l0Pmqwu8H',en,
1673117794634969089,2023-06-25T23:55:41.000Z,"b'By 2025, how many jobs in the United States will require some education beyond high school?'",en,
1672356853517529088,2023-06-23T21:31:59.000Z,b'I spent the last week in West Africa. Here are some of my favorite moments. https://t.co/pKUqRwBwZI',en,
1671985863134441473,2023-06-22T20:57:48.000Z,b'Warren\xe2\x80\x99s generosity plays an enormous role in achieving the foundation\xe2\x80\x99s ambitious goals and has made an impact on millions of lives. I always find it hard to adequately express how much our lifelong friendship and his support means to me. https://t.co/xPP3VB6Jin',en,
1671924934115983360,2023-06-22T16:55:41.000Z,"b'It was a pleasure to join you, @bosuntijani. I look forward to watching young people transform Nigeria with science and innovation. https://t.co/VqF9C2XklS'",en,
1671597774167756800,2023-06-21T19:15:40.000Z,b'I\xe2\x80\x99m inspired by Nigeria\xe2\x80\x99s youth and their potential to transform the future of their country\xe2\x80\x94and the world\xe2\x80\x94with science and innovation. #PanAfricanYouthIF23 \n\nWatch my conversation with young entrepreneurs here: https://t.co/h5K7MgWUVb https://t.co/MQ8d0W98YU',en,
1671329161431109632,2023-06-21T01:28:18.000Z,"b'I\xe2\x80\x99m looking forward to joining @bosuntijani in conversation with young entrepreneurs about the power of science and innovation at #PanAfricanYouthIF23, hosted by @Cc_HUB and @ULBSng: https://t.co/mPYkKapMwY https://t.co/wfBfukFNMK'",en,
1671286302350663680,2023-06-20T22:38:00.000Z,b'I am very excited to be back in Nigeria. This is my first trip in five years and so much has changed. I can\xe2\x80\x99t wait to meet with some of our great partners and learn from Nigeria\xe2\x80\x99s most valuable resource: its youth. https://t.co/HVb9cxxQT0',en,
1671018623752888325,2023-06-20T04:54:20.000Z,"b""Thank you @mohamedbazoum for your leadership on health, education, women\xe2\x80\x99s empowerment, and development. Our foundation has been working with talented Nigeriens for years to help ensure children's health and prevent the spread of polio. I look forward to strengthening our\xe2\x80\xa6 https://t.co/BsHsCnmigx https://t.co/N37Ev0JOoh""",en,
1669832656542920704,2023-06-16T22:21:43.000Z,"b'During my visit to China over the past two days, I\xe2\x80\x99ve seen first-hand some of the innovations that could contribute to global progress. https://t.co/Zl2thYUFuv'",en,
1669117890031943680,2023-06-14T23:01:30.000Z,"b""What an incredible life and legacy. I feel lucky to have worked with Bob on two books. He managed to be a champion for both the writer and the reader. He didn't want anything more than to help the book be the best possible version of itself. https://t.co/SKaK2vGaRM""",en,
1668978644897923073,2023-06-14T13:48:11.000Z,"b'Solving problems like climate change, health inequity and food insecurity requires innovation. From developing malaria drugs to investing in climate adaptation, China has a lot of experience in that. We need to unlock that kind of progress for more people around the world.'",en,
1668978642964152322,2023-06-14T13:48:11.000Z,"b'The world was making huge progress in reducing child deaths and poverty, but global crises set us back. African countries are particularly vulnerable, with high food prices, crushing debt, and increasing rates of TB and malaria. That\xe2\x80\x99s why I\xe2\x80\x99m heading to West Africa next.'",en,
1668978640414179329,2023-06-14T13:48:10.000Z,"b'I\xe2\x80\x99ve just landed in Beijing for the first time since 2019, where I\xe2\x80\x99m excited to visit with partners who have been working on global health and development challenges with @gatesfoundation for more than 15 years.'",en,
1668751908381802497,2023-06-13T22:47:13.000Z,b'This is a major achievement in providing equitable access to life-saving vaccines for children around the world. Let\xe2\x80\x99s continue working to ensure all children are protected from preventable diseases. #VaccinesWork https://t.co/3zlgmAnBmt',en,
1668680310098366464,2023-06-13T18:02:43.000Z,"b'I witnessed the transformative power of education at @chaffeycollege, where students are given the support they need to thrive throughout their journey from high school to college to career: https://t.co/htUIrLxlAk https://t.co/nswRvt82Vg'",en,
1668356028977803265,2023-06-12T20:34:08.000Z,"b'RT @gatesfoundation: Malaria is a complex &amp; unforgiving disease, but one that we can end if we work together.\n\n@Fredros_Inc &amp; @JenHatmaker\xe2\x80\xa6'",en,
1668294605748719617,2023-06-12T16:30:04.000Z,b'I binged all four seasons of Borgen. https://t.co/jUwpM0piwL',en,
1667219859074334720,2023-06-09T17:19:24.000Z,"b""Any Oregon Trail players out there? If so, you'll probably enjoy this book about two friends who fall in love with video games as kids and grow up to make games together. https://t.co/MXCB9deMaX""",en,
1666883497510981632,2023-06-08T19:02:49.000Z,b'I thoroughly enjoyed @hofrench\xe2\x80\x99s well-researched and thought-provoking history of Africa and can\xe2\x80\x99t recommend it enough. https://t.co/c3I6xjmmT6',en,
1665788370256265217,2023-06-05T18:31:10.000Z,"b'In 1995, I wrote about \xe2\x80\x9cthe internet tidal wave.\xe2\x80\x9d I even mentioned how the CD-ROM business would be dramatically impacted by the Internet. It\xe2\x80\x99s fun to look back and think about how far technology has come. https://t.co/IxntEFc6bh'",en,
1664690445513904128,2023-06-02T17:48:25.000Z,b'The world has made incredible progress against polio and other infectious diseases. I am thankful for partners like @UNICEF_Nigeria for their work to ensure all children receive the vaccines they need. https://t.co/1ogLudBllI',en,
1664684185737650177,2023-06-02T17:23:32.000Z,b'Vaccines work to #EndPolio and protect communities from dozens of other diseases. I am heartened to see that the #BigCatchUp is underway. https://t.co/oaLSgsD6Wv',en,
1664330408006402048,2023-06-01T17:57:45.000Z,"b'.@bjornlomborg and I agree\xe2\x80\x94the Global Goals are a phenomenal idea. This is the perfect time to assess our progress, recognize what\xe2\x80\x99s working, admit what isn\xe2\x80\x99t, and refine our approach so we can do the most good for the people most in need. https://t.co/H62VbgRkyl'",en,
1664281274012569602,2023-06-01T14:42:31.000Z,"b'Here\xe2\x80\x99s what I\xe2\x80\x99m listening to this summer. Hopefully, you\xe2\x80\x99ll think it\xe2\x80\x99s not too bad for a granddad. https://t.co/Li0dybFd9J'",en,
1663965924461006848,2023-05-31T17:49:26.000Z,"b'I hope you have plenty of content to enjoy this summer. If you\xe2\x80\x99re looking to add to your list, I\xe2\x80\x99ve got a few recommendations: https://t.co/KJo4B0BDP9 https://t.co/iXhEWv7sXm'",en,
1663680074175098881,2023-05-30T22:53:34.000Z,b'I\xe2\x80\x99m excited by the positive momentum around the Global Health Emergency Corps at last week\xe2\x80\x99s #WHA76. It\xe2\x80\x99s critical that countries don\xe2\x80\x99t let their guard down and join the effort to build a strong global network to help prevent and contain pandemic threats. https://t.co/qraK78Dz3p',en,
1663664565094322176,2023-05-30T21:51:56.000Z,"b'For the past decade, I\xe2\x80\x99ve recommended books to read each summer. This year, I\xe2\x80\x99m mixing it up. https://t.co/Y4gdaGYxzU'",en,
1663587466979459078,2023-05-30T16:45:34.000Z,"b'RT @gatesfoundation: The transition to high school is a game-changer, and ninth grade sets the stage for success in high school, college, a\xe2\x80\xa6'",en,
1661812592074194945,2023-05-25T19:12:51.000Z,b'It was an honor to meet Navajo Nation President @BuuVanNygren and First Lady @NygrenJasmine. https://t.co/COYtIsvGTP',en,
1661779678829637632,2023-05-25T17:02:04.000Z,"b'RT @MSuzman: For @GatesFoundation, our focus is driving a responsible approach to #AI that will be inclusive, equitable, &amp; reflect the need\xe2\x80\xa6'",en,
1659607133091139584,2023-05-19T17:09:09.000Z,"b'Really good news: Renewables now account for about one third of electricity generation globally, and the share is increasing. https://t.co/U3zsdUjbUm'",en,
1659226782669709313,2023-05-18T15:57:46.000Z,"b'RT @gatesfoundation: Still today, your zip code, access to care, and color of your skin can determine whether or not you and your baby surv\xe2\x80\xa6'",en,
1658527008387923969,2023-05-16T17:37:07.000Z,"b'I often say Richard Feynman is the best teacher I never had. If you haven\xe2\x80\x99t already, check out his work. Beyond his immense talent as an educator,  he\xe2\x80\x99s also quite the character. https://t.co/jC6iP7uaKT'",en,
1658112824604803079,2023-05-15T14:11:18.000Z,b'My message to the class of 2023. https://t.co/Zduz6ldbN5',en,
1657031689644695554,2023-05-12T14:35:15.000Z,"b'Ric was employee number 2 at Microsoft and a dear friend. He was also a tireless philanthropist, an advocate for LGBTQ+ rights and HIV/AIDS research, and an inspiration to me and so many others. His story is worth a watch: https://t.co/ASS0hp3Eug'",en,
1656761885746950144,2023-05-11T20:43:09.000Z,b'RT @AlzData: Applications are now open for the William H. Gates Sr. Fellowship from the AD Data Initiative! The two-year fellowship will su\xe2\x80\xa6',en,
1656761693190651906,2023-05-11T20:42:23.000Z,b'Building a clean energy future will require a lot of new wires\xe2\x80\x94the U.S. will need to grow the grid by almost two-thirds its current size in the next decade. https://t.co/XFkonneN3X',en,
1656721701915475968,2023-05-11T18:03:28.000Z,"b'It\xe2\x80\x99s possible to build nuclear reactors without enormous costs\xe2\x80\x94to our environment, our economy, or our health. This article details how it can be done to increase clean energy infrastructure. https://t.co/r01GHEg4Iq'",en,
1656378807912382464,2023-05-10T19:20:56.000Z,"b'I had the best day in Kemmerer, Wyoming. Over a coal plant tour, a site visit of the future Natrium plant, burgers, ice cream, and coffee, I got excited about the clean energy transition and the promise of next-generation nuclear: https://t.co/V8RO00hXKU https://t.co/kOInWbsJBE'",en,
1656330257585295363,2023-05-10T16:08:01.000Z,b'Expanding access to single-dose HPV vaccines could save 45 million lives worldwide over the next 100 years. This is a great example of why I\xe2\x80\x99m optimistic about the future of global health. https://t.co/DjaMRXOQle',en,
1656031621127241728,2023-05-09T20:21:20.000Z,"b'I\xe2\x80\x99m very encouraged by the E-MOTIVE Trial results released today at #IMNHC2023 to treat postpartum hemorrhage, the #1 cause of maternal mortality. This new approach led by @unibirmingham and @WHO could drastically improve women\xe2\x80\x99s chances of surviving childbirth globally.\xe2\x80\xa6 https://t.co/HP7fclWQV8'",en,
1656018194677768192,2023-05-09T19:27:59.000Z,"b'By prioritizing accessibility, affordability, and economic mobility, @NAU is redefining\xe2\x80\x94and increasing\xe2\x80\x94the value of a college degree. I can\xe2\x80\x99t wait to visit the school this weekend and see the incredible work they\xe2\x80\x99re doing up close. \nhttps://t.co/LwkO0KQUwl'",en,
1655657995043471360,2023-05-08T19:36:41.000Z,"b'Eradicating smallpox was hard, but it was also one of the most important achievements in human history. That makes it worth celebrating\xe2\x80\x94and learning from. https://t.co/OeblsUug3w'",en,
1655639424842223616,2023-05-08T18:22:53.000Z,"b'Nuclear energy, if we do it right, will help us solve our climate goals. Thanks for the great conversation, @rebeccajarvis. https://t.co/IoGM8qKcoO'",en,
1655302070319325184,2023-05-07T20:02:22.000Z,"b'Aside from water, there\xe2\x80\x99s no material on Earth we use more than concrete. That\xe2\x80\x99s why it\xe2\x80\x99s so important to figure out how to decarbonize it. https://t.co/49PLdExMU3'",en,
1654545546655461376,2023-05-05T17:56:12.000Z,"b'This next-generation nuclear facility will be a win for the local economy, America\xe2\x80\x99s energy independence, and the fight against climate change. https://t.co/u9P7uB64vQ'",en,
1654522375889895424,2023-05-05T16:24:08.000Z,"b'On International Day of the Midwife, I\xe2\x80\x99m thinking about Eva Nangalo\xe2\x80\x94a tireless advocate for mothers and babies and the next generation of trained #midwives in Uganda. #IDM2023 https://t.co/9JoyZceamm'",en,
1654209878645411850,2023-05-04T19:42:23.000Z,"b'RT @gatesfoundation: Is college the right choice for everyone?  \n\nOn this episode of \xe2\x80\x9cMake Me Care About,\xe2\x80\x9d @JenHatmaker and Jose Cruz River\xe2\x80\xa6'",en,
1653825855255351296,2023-05-03T18:16:25.000Z,"b'When I first met @dsengeh in 2011, I was blown away by his intellect, his ambition, and his sense of humor. His new book is a must-read for anyone who wants to help create a truly inclusive world. https://t.co/VGjrQjjgdn'",en,
1652432645790498816,2023-04-29T22:00:18.000Z,"b""As we rely more and more on electricity, it's vital to find innovative ways to generate clean power. https://t.co/74qlX65ZfJ""",en,
1652200756123164678,2023-04-29T06:38:51.000Z,"b'Mann ki Baat has catalyzed community led action on sanitation, health, women\xe2\x80\x99s economic empowerment and other issues linked to the Sustainable Development Goals. Congratulations @narendramodi on the 100th episode. https://t.co/yg1Di2srjE'",en,
1652035984987668480,2023-04-28T19:44:06.000Z,"b""To #EndPolio, we must immunize the world's most vulnerable children\xe2\x80\x94especially those who have not been vaccinated before. Protecting \xe2\x80\x98zero-dose\xe2\x80\x99 children against paralysis with polio vaccines like nOPV2 will help usher in a healthier future for us all. https://t.co/borglIQgNX""",en,
1651685317202821120,2023-04-27T20:30:41.000Z,"b'The connection is clear: when vaccine coverage goes down, we see more outbreaks of deadly diseases. That\xe2\x80\x99s why we must strengthen health systems and invest in new &amp; improved vaccines. #VaccinesWork https://t.co/pMUElNhSPp'",en,
1651656247937236992,2023-04-27T18:35:10.000Z,"b""This new fellowship powered by the AD Data Initiative aims to accelerate Alzheimer's research through data sharing and global collaboration. Early- and mid-career researchers and scientists in neuroscience or quantitative fields can apply in May. https://t.co/qahwBegySZ""",en,
1650938849718337538,2023-04-25T19:04:29.000Z,b'Everyone should have the same goal in mind: ending preventable diseases like polio. I had the pleasure of meeting @MichaelEssien last year. His ongoing support of protecting children is inspiring. #EndPolio #VaccinesWork https://t.co/vDYkQloN3I',en,
1650926809415041024,2023-04-25T18:16:38.000Z,"b'RT @MalariaNoMore: Today is #WorldMalariaDay!\n\nThanks to global efforts to fight #malaria, an estimated 2 billion cases have been prevented\xe2\x80\xa6'",en,
1650925775766577153,2023-04-25T18:12:32.000Z,"b'Despite being both preventable and curable, malaria still claims more than 600,000 lives each year. But this #WorldMalariaDay, I\xe2\x80\x99m filled with hope because of promising tools that could drastically change the game and help us #EndMalaria in a generation. https://t.co/VZvmV1KnNd'",en,
1650653133784379393,2023-04-25T00:09:09.000Z,b'This new discovery in mathematics is really cool. https://t.co/QSibsGbmDU',en,
1650554656010141696,2023-04-24T17:37:50.000Z,"b""Uganda\xe2\x80\x99s maternal mortality rate is at least double the global average. That's why Eva Nangalo has dedicated her life to making childbirth in the country safer for everyone involved. https://t.co/29AjdJehNY""",en,
1650339520712409089,2023-04-24T03:22:58.000Z,"b""They say the eyes are the windows to the soul, but they could also be the key to unlocking early info on cognitive disorders like Alzheimer's. https://t.co/7KHfLR6sN6""",en,
1650158130783985664,2023-04-23T15:22:11.000Z,b'You might see me using the \xe2\x80\x9cbathtub metaphor\xe2\x80\x9d next time I\xe2\x80\x99m describing carbon dioxide removal. This is a great explainer. https://t.co/cyib47tFsF',en,
1649165460955623424,2023-04-20T21:37:40.000Z,"b'RT @gatesfoundation: Chickpeas? Garbanzo beans?  \n \nNo matter what you call these little round legumes, they are one of the best ingredient\xe2\x80\xa6'",en,
1649156031904354304,2023-04-20T21:00:12.000Z,"b'This week in In San Diego, I got to talk with @jessieww about the issues with today\xe2\x80\x99s math curricula\xe2\x80\x94and the promises the future holds. https://t.co/BRxKtpa2pz'",en,
1649101726434332673,2023-04-20T17:24:25.000Z,"b'For decades, we\xe2\x80\x99ve been fighting back against deadly diseases by expanding access to lifesaving vaccines. Coming out of the pandemic, we\xe2\x80\x99re facing new challenges to #BuildBackImmunity\xe2\x80\x93and past successes have proven that we can overcome these challenges together. https://t.co/PF8Af8zUyl'",en,
1649086523093155843,2023-04-20T16:24:00.000Z,"b'It\xe2\x80\x99s always great catching up with @jessieww. We chatted about math, edtech, AI, and human ingenuity. Here\xe2\x80\x99s a look at our conversation. https://t.co/oT7pdEXRY4'",en,
1648092684698140672,2023-04-17T22:34:50.000Z,"b'I had a lot of fun meeting @CheechMarin, experiencing @TheCheechCenter, and learning a lot about his work to support the arts, education, and economic mobility for Mexican Americans. https://t.co/NXOHub9Scd'",en,
1645856798262591488,2023-04-11T18:30:13.000Z,"b'I am so impressed with Eva Nangalo\xe2\x80\x94it\xe2\x80\x99s hard not to be. She\xe2\x80\x99s spent decades making childbirth safer in Uganda for everyone involved, and she\xe2\x80\x99s become a mentor to countless other midwives in the process. https://t.co/79RHbrCt01'",en,
1645489412363661312,2023-04-10T18:10:22.000Z,b'I\xe2\x80\x99m grateful for the Lauder family\xe2\x80\x99s dedication to solving Alzheimer\xe2\x80\x99s. https://t.co/vX0qtjBFxt',en,
1644776053490196480,2023-04-08T18:55:44.000Z,b'I\xe2\x80\x99m excited to see @devisridhar\xe2\x80\x98s book in paperback. Her way of thinking about preparing for the next pandemic is one we should all pay attention to. https://t.co/g0HLziFG8q',en,
1644382110118195200,2023-04-07T16:50:20.000Z,"b'Happy Birthday, @WHO. Thank you for working to build a healthier future for us all. #WorldHealthDay https://t.co/CbIbUIv91c'",en,
1644014152204324864,2023-04-06T16:28:12.000Z,b'It\xe2\x80\x99s fascinating to see this enormous data digitization collaboration between @NMNH and other natural history museums around the world. https://t.co/7MkKeYNQtD',en,
1643647800671088643,2023-04-05T16:12:27.000Z,"b""Conversations about building a brighter future are essential to driving progress. And when the topic is clean energy, I'm always excited to listen. https://t.co/fagifaBur6""",en,
1643379385070936067,2023-04-04T22:25:52.000Z,"b'When I transitioned from @Microsoft to working full-time at the @GatesFoundation, I finally had the time to learn more about physics, chemistry, biology, and other sciences. So, I looked around for the best books and read as many of them as I could find. https://t.co/z2D5xGSeMj'",en,
1641917067304796162,2023-03-31T21:35:08.000Z,"b'I\xe2\x80\x99m excited about @gatesfoundation\xe2\x80\x99s new podcast. The opportunities to reduce inequity are out there, and @JenHatmaker does a wonderful job of showcasing innovative solutions to pressing global issues. https://t.co/Xalos3mSeP'",en,
1641859479485714433,2023-03-31T17:46:18.000Z,"b'With the right mindset, progress is possible. https://t.co/v8ov4OlqZ2'",en,
1641496541625221121,2023-03-30T17:44:07.000Z,"b'This is how close we are to truly self-driving cars (info from @SAEIntl). I believe we\xe2\x80\x99ll reach a tipping point within the next decade. When we do, AVs will change transportation as dramatically as the PC changed office work. https://t.co/E5hs17CG8b'",en,
1641496540153004034,2023-03-30T17:44:07.000Z,b'I\xe2\x80\x99m a car guy who enjoys the meditative (and fun) aspects of driving\xe2\x80\x93but I\xe2\x80\x99m also eagerly anticipating the day when I can hand over the keys to a machine. https://t.co/aMQjTLZVT1',en,
1641477128603729920,2023-03-30T16:26:59.000Z,b'Thank you @JNkengasong for your continued leadership. We look forward to building on @PEPFAR\xe2\x80\x99s progress and saving millions more lives. https://t.co/kVx7xcW2Wp',en,
1641458806797512706,2023-03-30T15:14:11.000Z,"b'Thank you @SecBlinken. I look forward to continuing our work together improving health, reducing poverty, and promoting global growth, creating a safer and more secure world. https://t.co/F6Xv09KhRf'",en,
1641142869028405250,2023-03-29T18:18:45.000Z,b'RT @susanbyrnes: Excited to share @gatesfoundation is launching a podcast! \xf0\x9f\xa5\x81\xf0\x9f\xa5\x81\xf0\x9f\xa5\x81   \n\nMake Me Care About with @JenHatmaker will offer in-depth\xe2\x80\xa6',en,
1641118687468961799,2023-03-29T16:42:40.000Z,"b'I recently had the chance to test drive\xe2\x80\x94or test ride, I guess\xe2\x80\x94one of @wayve_ai\xe2\x80\x99s autonomous vehicles. It was a pretty wild ride: https://t.co/PrwrxU49dd https://t.co/NtnkVx7sBx'",en,
